{
  "schema_version": "covenant.approval-ticket.v1",
  "ticket_id": "ticket-full-rsi-evidence",
  "task_id": "publish_rsi_claim",
  "effect_type": "claim.publish",
  "resource": "full-autonomous-self-mutating-rsi",
  "approved": true,
  "reason": "mutation authority evidence packet covenant.live-self-change-authority.v1, rollback evidence, and live self-change evidence verified by AO Covenant",
  "operator_id": "ao-operator"
}
